{
  "world_id": "world",
  "state_id": 14,
  "checksum": "fnv1a_7ce5f2eb",
  "name": "State_14",
  "aliases": [
    "The Strandhold",
    "Longstrand Precinct"
  ],
  "timeline_beats": [
    {
      "id": "tb1",
      "label": "First permanent coastal settlement founded",
      "ybp": 10500,
      "refs_world_events": [
        "Age of First Coasts"
      ]
    },
    {
      "id": "tb2",
      "label": "Integrated into regional trade/leagues",
      "ybp": 3800,
      "refs_world_events": [
        "River-Kingdoms & Leagues"
      ]
    },
    {
      "id": "tb3",
      "label": "Rebuilding after flux-era raids; formal Harbor Charter codified",
      "ybp": 1200,
      "refs_world_events": [
        "Age of Flux"
      ]
    },
    {
      "id": "tb4",
      "label": "Joined Coastal Defense Compact; fisheries treaty ratified",
      "ybp": 300,
      "refs_world_events": [
        "Present Order"
      ]
    }
  ],
  "factions": [
    {
      "id": "f1",
      "label": "Harbor Council",
      "influence_hint": "administration, legal charter holders, medium influence"
    },
    {
      "id": "f2",
      "label": "Fisher-Guild Cooperative",
      "influence_hint": "mass membership, controls quotas and seasonal labor"
    },
    {
      "id": "f3",
      "label": "Saltwrights & Shipwrights Union",
      "influence_hint": "controls ship repair, saltworks, technical ritual workshops"
    },
    {
      "id": "f4",
      "label": "Harbor Guard (naval militia)",
      "influence_hint": "security and enforcement, strong local arm"
    },
    {
      "id": "f5",
      "label": "Merchant Liturgical Houses",
      "influence_hint": "trade-financing and ritual brokerage, external links"
    }
  ],
  "economy_pillars": [
    "fishing",
    "salt-production",
    "shipbuilding/repair",
    "coastal trade",
    "ritual-augury services"
  ],
  "culture": {
    "language_family": "Coastal Tongues",
    "traits": [
      "boat-name and kin-track communal identity",
      "oral sea-song navigational practice",
      "market-centered dispute resolution",
      "artisan-runic craft traditions",
      "seasonal migratory rhythms"
    ]
  },
  "religion": {
    "families_present": [
      "Sea-Tide Animisms",
      "Ancestor-Remembrance Cults",
      "Merchant Brotherhood Liturgies"
    ],
    "dominant": "Sea-Tide Animisms"
  },
  "regions": [
    {
      "id": "r1",
      "label": "North Longstrand",
      "tags": [
        "coastal",
        "saltworks"
      ]
    },
    {
      "id": "r2",
      "label": "Outer Docklands",
      "tags": [
        "trade-hub",
        "shipyards"
      ]
    },
    {
      "id": "r3",
      "label": "Reefward Isles",
      "tags": [
        "islands",
        "reef-protected"
      ]
    },
    {
      "id": "r4",
      "label": "Saltmarch Flats",
      "tags": [
        "marsh",
        "seasonal-fishing"
      ]
    },
    {
      "id": "r5",
      "label": "Market Quarter (Harborward)",
      "tags": [
        "trade-hub"
      ]
    }
  ],
  "external_relations_refs": [
    {
      "type": "alliance",
      "id": "A2",
      "label_hint": "Coastal Defense Compact"
    },
    {
      "type": "alliance",
      "id": "A5",
      "label_hint": "Northern Fishing Coalition"
    },
    {
      "type": "treaty",
      "id": "T3",
      "label_hint": "Fisheries Sharing Agreement"
    },
    {
      "type": "trade_bloc",
      "id": "TB3",
      "label_hint": "Northern Fishers' Cooperative"
    }
  ],
  "constraints": [
    "No instant resurrection or true life-replacement magics",
    "Long-range mind influence is rare and institutionally banned",
    "Navigational auguries exist but cannot replace charts and seamanship",
    "Ritual magic consumes scarce imported reagents or specialized labor",
    "Combustion-derived industry limited (no high-pressure steam megatechs)",
    "Must honor alliance/treaty obligations listed in external_relations_refs"
  ],
  "notes": [
    "High dependence on seasonal migratory fish and salted-catch exports",
    "Ritual workshops require imported reagents; supply vulnerability affects ship repairs and auguries",
    "Harbor Charter codifies fishing quotas; enforcement is a recurring domestic friction point",
    "Membership in Coastal Defense Compact implies mutual defense patrol rotations",
    "Pilot auguries commonly used for local guidance but legal requirement to carry charts and trained pilots",
    "Storm surge and reef-shift risks shape settlement patterns and shipyard placement",
    "Factions: recurring tensions between Harbor Council regulators and Fisher-Guild quota demands"
  ],
  "generated_at": "2025-09-09T04:58:58.997Z"
}