{
  "world_id": "world",
  "state_id": 5,
  "checksum": "fnv1a_6735bff9",
  "name": "State_5 (coastal)",
  "aliases": [
    "State Five",
    "The Fifth Coast",
    "Glassharbor Dominion"
  ],
  "timeline_beats": [
    {
      "id": "B1",
      "label": "Initial coastal settlement and reef-harbor founding",
      "ybp": 8000,
      "refs_world_events": []
    },
    {
      "id": "B2",
      "label": "Integration into regional river-coast trade networks",
      "ybp": 3200,
      "refs_world_events": []
    },
    {
      "id": "B3",
      "label": "Great Naval War; major fleet actions off state shores",
      "ybp": 1400,
      "refs_world_events": [
        "W1"
      ]
    },
    {
      "id": "B4",
      "label": "Territorial shifts and port reorganization after naval conflict",
      "ybp": 1100,
      "refs_world_events": [
        "BC4"
      ]
    },
    {
      "id": "B5",
      "label": "Entry into maritime accords and trade bloc membership",
      "ybp": 200,
      "refs_world_events": [
        "T1",
        "A1",
        "TB1"
      ]
    }
  ],
  "factions": [
    {
      "id": "F1",
      "label": "Harbor Merchants Guild",
      "influence_hint": "dominant economic / controls customs and long-distance trade contracts"
    },
    {
      "id": "F2",
      "label": "Tide-Templars",
      "influence_hint": "religious order; controls ritual auguries for navigation and coastal rites"
    },
    {
      "id": "F3",
      "label": "Shipwrights & Chandlers Combine",
      "influence_hint": "industrial; controls shipbuilding yards and reagent-linked workshops"
    },
    {
      "id": "F4",
      "label": "Coastal Patriciate",
      "influence_hint": "political land-owners; ports and fortifications"
    },
    {
      "id": "F5",
      "label": "Estuary Shadow Network",
      "influence_hint": "informal smugglers and brokers; influence in border/black-market trade"
    }
  ],
  "economy_pillars": [
    "shipbuilding",
    "long-distance maritime trade",
    "fisheries & saltworks",
    "navigational-augury services",
    "reagent import/trading"
  ],
  "culture": {
    "language_family": "Coastal Tongues",
    "traits": [
      "seafaring oral navigational lore",
      "guild-centered apprenticeship culture",
      "clan-linked harbor kinship",
      "practical ritualism tied to voyages",
      "commercial pragmatism with formal hospitality codes"
    ]
  },
  "religion": {
    "families_present": [
      "Sea-Tide Animisms",
      "Merchant Brotherhood Liturgies",
      "Ancestor-Remembrance Cults"
    ],
    "dominant": "Sea-Tide Animisms"
  },
  "regions": [
    {
      "id": "R1",
      "label": "Glassharbor",
      "tags": [
        "trade-hub",
        "coastal",
        "fortified"
      ]
    },
    {
      "id": "R2",
      "label": "North Firth",
      "tags": [
        "coastal",
        "shipyards"
      ]
    },
    {
      "id": "R3",
      "label": "Saltmarsh Flats",
      "tags": [
        "coastal",
        "saltworks",
        "resource"
      ]
    },
    {
      "id": "R4",
      "label": "River-mouth Quarter",
      "tags": [
        "estuary",
        "trade-hub"
      ]
    },
    {
      "id": "R5",
      "label": "Southern Headlands",
      "tags": [
        "coastal",
        "naval-base"
      ]
    },
    {
      "id": "R6",
      "label": "High Cliffs Watch",
      "tags": [
        "coastal",
        "lookout"
      ]
    }
  ],
  "external_relations_refs": [
    {
      "type": "alliance",
      "id": "A1",
      "label_hint": "Maritime Trading League"
    },
    {
      "type": "war",
      "id": "W1",
      "label_hint": "Great Naval War"
    },
    {
      "type": "treaty",
      "id": "T1",
      "label_hint": "Open-Seas Treaty"
    },
    {
      "type": "border_change",
      "id": "BC4",
      "label_hint": "Territorial Shifts after Great Naval War"
    },
    {
      "type": "trade_bloc",
      "id": "TB1",
      "label_hint": "Sea Trade Union"
    }
  ],
  "constraints": [
    "No instant resurrection or true life-replacement magics",
    "Long-range mind influence is rare and institutionally banned",
    "Navigational auguries cannot replace charts or seamanship",
    "Combustion-derived industry limited; no high-pressure steam megatechs",
    "Ritual magic consumes scarce imported reagents or specialized labor",
    "Must comply with Open-Seas Treaty (T1) obligations and post-war border settlements (BC4)"
  ],
  "notes": [
    "High dependence on imported reagents and maritime trade routes for ritual and industry",
    "Factional tensions: Harbor Merchants vs. Tide-Templars over control of auguries and port policy",
    "Coastal exposure makes naval capability and alliance membership (A1/TB1) strategically critical",
    "Smuggling networks exploit post-war border reorganization (BC4); enforcement uneven"
  ],
  "generated_at": "2025-09-09T05:00:38.586Z"
}